{"$schema":"https://json-schema.org/draft/2020-12/schema","$id":"https://filmfoundry.dev/schemas/location-reference.v2.json","type":"object","additionalProperties":false,"required":["location_id","preferred_view","anchor_objects","camera_side","light_sources","geometry_controls","does_not_control"],"properties":{"location_id":{"type":"string"},"preferred_view":{"type":"string"},"anchor_objects":{"type":"array"},"camera_side":{"type":"string"},"light_sources":{"type":"array"},"geometry_controls":{"type":"string"},"does_not_control":{"type":"string"},"extensions":{"type":"object"}}}
